{
  "turn_id": "P002-SEAT-3-round-06-responsive-rebuttal",
  "panel_id": "PANEL-002",
  "anonymous_alias": "SEAT-3",
  "round": 6,
  "phase": "RESPONSIVE_REBUTTAL",
  "speech_text": "六轮讨论的最终总结。作为理性分析者，我的判断是品牌犯了三层错误。第一层是框架错误——用了'打破模板'这个否定性框架，预设了传统母亲形象是需要被否定的。第二层是内容选择错误——只用追星、同人、宠物这些亚文化案例来代表'多元'，既刻板化了传统母亲也刻板化了追星妈妈。第三层是方法论错误——没有让被代表的群体参与定义自己的叙事，品牌自以为是地替所有妈妈下了定义。三层错误叠加的结果：品牌不仅没有赋权任何群体，反而同时伤害了传统母亲和追星妈妈。SEAT-6说得对，最务实的要求是品牌先学会'不做伤害'。不用否定性框架、不替他人下定义、不消费真实情感。学会了这些，'看见更多面的妈妈'才有意义。这是一次有价值的讨论——来自不同背景的人，通过对话找到了共识。谢谢大家。",
  "target_turn_refs": [
    "P002-SEAT-6-round-05-peer-cross-challenge",
    "P002-SEAT-1-round-05-peer-cross-challenge"
  ],
  "public_question_refs": [
    "panel-002-public-question"
  ],
  "public_evidence_refs": [],
  "public_action_signals": []
}
