{
  "turn_id": "ASGN-002-004-round-02-direct-rebuttal",
  "panel_id": "PANEL-002",
  "anonymous_alias": "SEAT-4",
  "round": 2,
  "phase": "DIRECT_REBUTTAL",
  "speech_text": "我想补充说几句哈。\n\nSEAT-3说Tim是拍节目，不是真去相亲，所以不算欺骗。但我有个问题——那些阿姨知道你在拍节目吗？她们知道面前这个人是在'演戏'吗？\n\n我给你说个我们镇上的事。去年隔壁王姐家的闺女去相亲，男方说自己'做生意挺成功的'，结果结婚以后才发现就是个摆地摊的，还欠了一屁股债。王姐气得在村口骂了三天。你说那个男的'没有一句假话'吗？他确实在'做生意'，只不过是摆地摊。这算不算选择性真实？算不算欺骗？在王姐和她闺女看来，这就是骗。\n\n你可能会说这个例子跟Tim不一样，人家是拍节目。但我想说的是，信息诚信这个事，不看你是拍节目还是真相亲，而是看接收信息的人是不是在被误导的前提下做出了反应。那些阿姨是认真在跟他聊的，认真在说'学历太低了''你要有实力'。她们的反应是真实的，但触发她们反应的信息是被筛选过的。\n\n我也不是要对Tim赶尽杀绝，我知道他是做内容的。但我想替那些被当作素材的普通人说句话——她们的真诚不应该成为别人节目效果的素材，至少不应该是在被误导的情况下。\n\nSEAT-1说得对，关键看整体效果。从那些阿姨的视角来看，她们就是被骗了。",
  "target_turn_refs": [
    "ASGN-002-003-round-01-opening",
    "ASGN-002-001-round-01-opening"
  ],
  "public_question_refs": [
    "选择性真实算不算欺骗？"
  ],
  "public_evidence_refs": [
    "C001",
    "C003"
  ],
  "public_action_signals": []
}
