{
  "turn_id": "ASGN-004-006-round-03-peer-cross-challenge",
  "panel_id": "PANEL-004",
  "anonymous_alias": "SEAT-6",
  "round": 3,
  "phase": "PEER_CROSS_CHALLENGE",
  "speech_text": "听了大家的讨论，我觉得SEAT-1的上限论和SEAT-2的无限论都有道理但都不够精确。我想提出一个新的角度：预防义务不应该看粉丝数量，也不应该简单地设上限或不上限，而应该看内容本身的歧义风险。什么叫歧义风险？就是这段内容脱离原始语境后，被误读的可能性和严重程度。Tim那个相亲简历，写国内初中学历实际是英国本科，写摄影师实际是CEO，写快递相关实际是圆通总裁。这种选择性真实的信息策略，脱离语境后几乎必然会被严重误读——这就是高歧义内容。对于高歧义内容，创作者的预防义务就应该更严格：要明确标注这是节目效果，要在内容中提供足够的背景信息，要预判可能的误读方向并主动澄清。如果创作者做到这些了，但还是被恶意切片，那主要责任在切片者。但如果创作者没有做这些预防就发布了高歧义内容，那他就要承担相应的后果。所以我的双责论可以进一步细化：责任分配不是固定比例的，而是根据内容的歧义风险和创作者的预防措施来动态评估的。风险高、预防少，创作者责任就大。风险低、预防到位，创作者责任就小。这比笼统地说有没有上限要精确得多。",
  "target_turn_refs": ["ASGN-004-001-round-03-peer-cross-challenge", "ASGN-004-002-round-03-peer-cross-challenge"],
  "public_question_refs": ["panel-004-public-question"],
  "public_evidence_refs": ["C001", "C002", "C003", "C011"],
  "public_action_signals": []
}