{
  "turn_id": "P002-SEAT-06-round-05-peer-cross-challenge",
  "panel_id": "PANEL-002",
  "anonymous_alias": "SEAT-06",
  "round": 5,
  "phase": "PEER_CROSS_CHALLENGE",
  "speech_text": "SEAT-01说的心理援助这个建议我听了觉得好。我们镇上就是这样的嘛，谁家出了事，邻居们就去坐坐聊聊天。虽然没有专业的什么心理咨询师，但就是有人在你身边陪你说说话，心里就好受一些。城市里的人可能反而缺少这种支持。\n\nSEAT-04说的法律不只是惩罚还能预防，这个我第一次听说，但想想确实有道理。就好比我们镇上以前没有路灯经常有人摔跤，后来装了路灯就没人摔了。预防比治疗重要嘛。\n\nSEAT-02认错了就好，年轻人能认错说明还有救。我们打麻将的时候也是，吵完了还不是一起喝茶。和气生财嘛。\n\n这个讨论到第五轮了，我觉得比前面几轮和气多了。大家从吵网暴对不对变成了讨论怎么预防悲剧，这个转变好。\n\n做人要厚道，这句话我说了好几轮了。现在再加一句：有困难的时候找人聊聊，别憋着。这也是厚道——对别人厚道，也要对自己厚道。\n\n跟我没关系我就是一个卖东西的。不过这个讨论确实让我想了挺多。",
  "target_turn_refs": [
    "P002-SEAT-01-round-05-peer-cross-challenge",
    "P002-SEAT-04-round-05-peer-cross-challenge"
  ],
  "public_question_refs": [
    "姐姐刘某的网络曝光行为——'为弟申冤'的正义感与'蓄意网暴'的违法性之间的冲突"
  ],
  "public_evidence_refs": [],
  "public_action_signals": []
}
