{
  "turn_id": "ASN-P2S5-round-03-peer-cross-challenge",
  "panel_id": "PANEL-002",
  "anonymous_alias": "SEAT-5",
  "round": 3,
  "phase": "PEER_CROSS_CHALLENGE",
  "speech_text": "你问为什么贬义词都是女字旁，这个我还真想了一下。说实话我想来想去，男字旁的贬义词还真想不出来几个。这个现象确实有点奇怪，我不否认。但是我觉得奇怪归奇怪，不能因为这个就说那篇文章全对。那篇文章的问题是它说所有女字旁的字都被污名化了，这明显不对——好字安字娇字妙字婷字这些不是好的吗？所以我的看法是：可能确实有些女字旁的贬义词反映了历史上的偏见，这个值得思考；但是不能一刀切说所有女字旁的字都被搞坏了，那就是另一个极端了。过日子也是这样，啥事都不能走极端，一走极端就容易出问题。就像我们超市搞促销，打折太多老板亏本，不打折客人不来，得找个中间点。",
  "target_turn_refs": [
    "ASN-P2S1-round-02-direct-rebuttal",
    "ASN-P2S2-round-02-direct-rebuttal"
  ],
  "public_question_refs": [
    "cherry-picking-overgeneralization-pattern"
  ],
  "public_evidence_refs": [],
  "public_action_signals": []
}
