{
  "turn_id": "ASGN-001-004-round-05-peer-cross",
  "panel_id": "PANEL-001",
  "anonymous_alias": "SEAT-4",
  "round": 5,
  "phase": "PEER_CROSS_CHALLENGE",
  "speech_text": "SEAT-1大姐，你说的对，我那个超市新员工的比喻确实不恰当。新员工收错钱是真的搞错了，不知道哪个键按错了。Tim不是搞错了——他知道自己的身份，他选择隐瞒了。这个确实不是无心之失，是他自己选的。这一点我想明白了。\n\nSEAT-2你盘点的四个共识点，我都同意：Tim的行为是阶层消费，他需要道歉改进，行业需要知情同意规范，营销号也要管。这四条说得很全面，我没意见。\n\n我就说一点收尾的想法吧。我们五轮讨论下来了，从一开始吵得很凶，到现在慢慢形成了共识。我觉得这个过程挺好的——说明大家都是讲道理的人。SEAT-3承认了行为有问题，SEAT-5撤了'轻度'，SEAT-6一直在推动制度建设。大家都在让步，都在进步。\n\n我觉得一个好的结论应该是这样的：Tim做得不对，需要道歉和改进，这一点没得商量。但道歉了改进了就应该给机会，不应该一辈子揪着不放。制度建设要跟上——不光是Tim一个人的问题，是整个行业需要规矩。营销号也不能无法无天，切别人视频瞎编标题也得管。\n\n我觉得我们其实没有那么多根本分歧了。剩下的就是措辞的问题——说'行为构成阶层消费'还是'行为造成阶层消费效果'，说'正式道歉'还是'更诚恳的道歉'。这些细节当然重要，但方向是一致的。\n\n大家消消气，好好收个尾吧。",
  "target_turn_refs": [
    "ASGN-001-001-round-04-responsive-rebuttal",
    "ASGN-001-002-round-04-responsive-rebuttal"
  ],
  "public_question_refs": [
    "富人伪装底层去相亲角，是创意内容还是阶层消费？"
  ],
  "public_evidence_refs": [
    "C006",
    "C013"
  ],
  "public_action_signals": []
}
