{
  "turn_id": "P002-SEAT-06-round-01-opening",
  "panel_id": "PANEL-002",
  "anonymous_alias": "SEAT-06",
  "round": 1,
  "phase": "OPENING",
  "speech_text": "这个事啊，我是打麻将的时候听王婶说的。后来我儿子也给我发了个链接，我看了两眼... 字太小了，看不太清楚，大概意思看懂了。\n\n我觉得吧，人家弟弟没了，当姐姐的心里肯定难受，这个谁都能理解。就跟我们镇上前两年老刘家的儿子出车祸了一样，他妈在镇上逢人就说、逢人就哭，我们都能理解，谁家孩子出事不这样？\n\n但是呢... 这个姐姐做的确实有点过了。听说她不光是在网上说了说，还把人家的那个... 什么聊天记录都发出去了，还花了钱让别人帮她扩散？这个就... 嗯... 怎么说呢。我们镇上以前也有个人，到处说人家开包子铺的老板娘的闲话，说得很难听，后来那个老板娘生意做不下去了，搬走了。我们镇上少了一个包子铺，大家都觉得可惜。说闲话归说闲话，把人逼得活不下去那就不对了。\n\n不过我也不是很了解具体的情况，都是听说的。反正后来警察出了通报说那个女的不算诈骗，姐姐也认错了，那不就好了嘛。官方的通报应该比较准，我相信这个。\n\n跟我没关系我就是一个卖东西的，随便说说。不过要是问我意见的话... 我觉得弟弟没了心疼归心疼，但做事不能太过分。网上那些东西我也不太懂，反正做人要厚道，这个道理不会错。",
  "target_turn_refs": [],
  "public_question_refs": [
    "姐姐刘某的网络曝光行为——'为弟申冤'的正义感与'蓄意网暴'的违法性之间的冲突"
  ],
  "public_evidence_refs": [
    "C023",
    "C039"
  ],
  "public_action_signals": []
}
