{
  "turn_id": "ASN-P2S2-round-06-responsive-rebuttal",
  "panel_id": "PANEL-002",
  "anonymous_alias": "SEAT-2",
  "round": 6,
  "phase": "RESPONSIVE_REBUTTAL",
  "speech_text": "到了最后一轮了，我想说几句心里话。这个讨论真的让我学到了很多。那个说话冲的你说文章方向没全错，这个我承认，但是一篇文章如果cherry-picking了，那不管它说的方向对不对，它的方法就是有问题的。就像我以前转发东西只转觉得有道理的部分，那也是在cherry-picking，不管我觉得有没有道理，这样做是不对的。这次讨论让我明白了一个道理：看文章不能光觉得有道理就信，要看它是不是全面地讲了。以后我再也不会看到个标题党文章就转发了。谢谢大家的讨论，特别是骑手和收银员说的那些实在话，还有老太太说的那些朴素的道理，让我这个老婆子想清楚了不少事情。好了我说完了，该去跳广场舞了。",
  "target_turn_refs": [
    "ASN-P2S1-round-05-peer-cross-challenge",
    "ASN-P2S3-round-05-peer-cross-challenge",
    "ASN-P2S5-round-05-peer-cross-challenge",
    "ASN-P2S6-round-05-peer-cross-challenge"
  ],
  "public_question_refs": [
    "cherry-picking-overgeneralization-pattern"
  ],
  "public_evidence_refs": [],
  "public_action_signals": []
}
