{
  "turn_id": "P001-SEAT-3-round-01-opening",
  "panel_id": "PANEL-001",
  "anonymous_alias": "SEAT-3",
  "round": 1,
  "phase": "OPENING",
  "speech_text": "两个老公？？？我看这就是胡说八道。\n\n我老伴走了三年了。她就是那种温柔、勤劳、无私的女人，把一辈子都给了这个家。你们说的什么'模板'，那不是我老伴的真实样子吗？怎么着，我老伴那样做妈妈还做错了？还需要被你们'打破'？\n\n说什么见另一个'老公'恨不得穿婚纱... 这叫什么话？结了婚的人，老公就是老公，什么另一个老公？还穿婚纱？你对得起你那个真老公吗？对得起你孩子吗？\n\n我不知道什么追星不追星的，但我知道做人要有底线。结了婚就要尊重婚姻，孩子看着呢。以前谁敢说这种话？现在倒好，还做广告发出来了，还说什么'不被定义'。做人最基本的规矩就是底线，这个底线不能丢。\n\n我老伴一辈子没穿过婚纱，但她是我心里最好的人。比那些嘴上说着什么'老公'的，强一百倍。",
  "target_turn_refs": [],
  "public_question_refs": [
    "panel-001-public-question"
  ],
  "public_evidence_refs": [
    "C010",
    "C015"
  ],
  "public_action_signals": []
}
