{
  "turn_id": "ASGN-004-006-round-06-responsive-rebuttal",
  "panel_id": "PANEL-004",
  "anonymous_alias": "SEAT-6",
  "round": 6,
  "phase": "RESPONSIVE_REBUTTAL",
  "speech_text": "六轮讨论结束了，我想做一个最终的总结。回顾整个过程，我觉得最值得骄傲的是：我们从分歧中生长出了共识。一开始，大家的立场差距很大——有人认为创作者完全不应该负责，有人认为创作者应该负全责。但通过六轮的讨论和交锋，我们逐步建立了一个精细的分析框架。四维综合框架界定了责任的基本维度：切片者的恶意歪曲是主责、创作者的可验证预防义务、基于歧义风险的动态评估、平台的治理责任。三层验证机制回应了谁来执行的质疑：自我检查、行业标准、公众监督。嵌入不可剥离语境信息提供了技术方案：让语境跟着内容走，即使被切片也不容易丢失。SEAT-2的挑战是建设性的——他逼迫我们不断完善框架的薄弱环节。SEAT-3的行业经验让框架更加落地。SEAT-4和SEAT-5的朴素道理提醒我们：解决方案要简单有效，不能太复杂。回到最初的问题：创作者是否要为传播变形负责？答案不是简单的有或没有，而是：创作者要为合理可执行的预防措施负责，具体标准根据内容的歧义风险动态评估，执行通过三层机制验证。这是一个有实操价值的答案，不是空洞的口号。",
  "target_turn_refs": ["ASGN-004-001-round-06-responsive-rebuttal", "ASGN-004-002-round-06-responsive-rebuttal"],
  "public_question_refs": ["panel-004-public-question"],
  "public_evidence_refs": ["C004", "C005", "C011"],
  "public_action_signals": []
}
