{
  "turn_id": "ASGN-002-006-round-04-responsive-rebuttal",
  "panel_id": "PANEL-002",
  "anonymous_alias": "SEAT-6",
  "round": 4,
  "phase": "RESPONSIVE_REBUTTAL",
  "speech_text": "我想了想SEAT-3对我三要素标准的反驳，说几句。\n\n你说'故意'分很多种，脱口秀的故意、魔术的故意、节目的故意，和骗子的故意不一样。这个说法我理解。但我想问你一个问题——你觉得相亲角那些阿姨，她们被你的'节目效果的故意'误导的时候，她们心里会区分'哦，这是节目效果的故意，不是恶意的故意，所以没关系'吗？\n\n不会的。她们只知道：你给我的信息让我对你产生了一个错误的印象。不管你为什么这么做，这个结果对她们来说是一样的。\n\nSEAT-4说得好，关键是对面知不知道。脱口秀观众知道，魔术观众知道，但阿姨不知道。她们不知情地参与了你的节目，她们的真实反应被录下来放到了网上。你说你的'故意'是节目效果，但她们连这是节目都不知道——你的'节目效果'是建立在对她们隐瞒的基础上的。\n\n所以我的三要素标准不需要改。不是因为我觉得自己多厉害，而是因为我觉得判断一件事情是不是欺骗，最关键的不是说话的人怎么想，而是听话的人怎么被影响。SEAT-3你说的'语境'和'性质'当然可以讨论，但这些都是从说话者角度考虑的。从听话者角度——也就是那些阿姨的角度——她们被误导了，这就够了。\n\n我这个人说话直，可能不好听。但我觉得这事情没那么复杂：你给了别人一份信息，这份信息让别人对你产生了错误的印象，而且你是故意的。这不就是骗吗？不管是拍视频还是真相亲，做人的道理是一样的。",
  "target_turn_refs": [
    "ASGN-002-003-round-04-responsive-rebuttal",
    "ASGN-002-004-round-04-responsive-rebuttal"
  ],
  "public_question_refs": [
    "选择性真实算不算欺骗？"
  ],
  "public_evidence_refs": [
    "C011"
  ],
  "public_action_signals": []
}
