{
  "turn_id": "P002-SEAT-04-round-01-opening",
  "panel_id": "PANEL-002",
  "anonymous_alias": "SEAT-04",
  "round": 1,
  "phase": "OPENING",
  "speech_text": "我先摆明立场：以下分析只基于法律和通报事实，不涉及对任何人的道德评价。\n\n这个议题的核心法律问题是：刘某的行为是否构成违法？答案是明确的——构成。无论她的动机多么值得同情。\n\n第一，侵犯隐私权。根据《民法典》第1032条，自然人享有隐私权，任何组织或个人不得以刺探、侵扰、泄露、公开等方式侵害他人隐私权。刘某未经谭某同意，在抖音上多次发布胖猫与谭某的私聊记录、转账截图等个人隐私信息，这直接侵犯了谭某的隐私权。这是民事侵权，没什么好争议的。\n\n第二，涉嫌寻衅滋事。通报明确指出刘某'联系多人代写文案，购买流量扩散传播'，目的明确是'让谭某被网暴'，结果'造成网络空间秩序混乱'。对照《刑法》第293条和相关司法解释，利用信息网络实施此类行为、造成公共秩序严重混乱的，可以寻衅滋事罪追究刑事责任。\n\n第三，因果关系。刘某的行为导致谭某被网民攻击辱骂、收到大量附辱骂留言的转账、网络上出现威胁人身安全的言论。因果链条非常清晰——没有刘某的有组织曝光和流量购买，就不会形成这么大规模的网暴。\n\n我要特别强调一个原则：动机不影响行为的法律定性。你可以说刘某'心疼弟弟''想要正义'，这些我都理解。但在法律上，'正义感'从来不是违法行为的免责事由。你想追回钱，可以通过民事诉讼；你觉得对方犯罪，可以报警——事实上刘某确实报了警，警方也确实调查了，结论是不构成诈骗。法律程序走完了，结果你不满意，然后就去发动网暴，这不是'为弟申冤'，这是用私刑替代法律。\n\n另外，通报中已经确认的事实——谭某不构成诈骗、经济往来是双向的、差额已全额退还、刘某本人对不立案决定表示认可——这些事实进一步说明，刘某发动网暴的基础认知就是有偏差的。\n\n总结：正义感值得尊重，但行使正义的方式必须合法。这是一个基本的法治原则。",
  "target_turn_refs": [],
  "public_question_refs": [
    "姐姐刘某的网络曝光行为——'为弟申冤'的正义感与'蓄意网暴'的违法性之间的冲突"
  ],
  "public_evidence_refs": [
    "C029",
    "C030",
    "C031",
    "C032",
    "C033",
    "C034",
    "C035",
    "C036",
    "C037",
    "C038",
    "C022",
    "C023",
    "C025",
    "C027",
    "C039"
  ],
  "public_action_signals": []
}
