{
  "turn_id": "P001-SEAT-03-round-01-opening",
  "panel_id": "PANEL-001",
  "anonymous_alias": "SEAT-03",
  "round": 1,
  "phase": "OPENING",
  "speech_text": "看了通报心里真的很难受。我是一个二胎妈妈，大儿子上初中，小女儿三岁。看到胖猫才21岁就走了，真的心疼得不行。做妈妈的都懂，养一个孩子从小到大付出多少心血，21年啊，说没就没了。他爸妈怎么受得了。\n\n通报说两个人是真实恋爱关系，我看完觉得这个判断是合理的。年轻人谈恋爱谁不花钱呢？我和我老公谈恋爱那会儿，他也是把工资卡给我让我管，我们一起攒钱买房。通报里说谭某也转了46.3万回去，还开了情侣攒钱账户一起存钱。这不是正常谈恋爱是什么？而且胖猫姐姐都认可了警方的调查结果，双方父母也和解了。一家人都接受了的事情，网上的人凭什么比当事人还激动呢。\n\n我不是学法律的，说不出什么专业术语。但我从一个普通人的角度觉得，两个人在一起两年多，互相见了家长，一起过年，一起攒钱开店，这怎么可能是诈骗呢。我弟弟也在外地打工，每年就过年回来一次，每次视频看他瘦了我都心疼。胖猫自己那么拼命挣钱，又是自己转的账，最后一笔还备注了'自愿赠予'。这个孩子太让人心疼了。\n\n我最希望的是，大家能多点善意。网上那些骂人、人肉搜索、甚至威胁要杀人全家的，真的太过分了。想想如果是自己的孩子被这样对待呢？愿逝者安息，也希望胖猫的爸妈能坚强。",
  "target_turn_refs": [],
  "public_question_refs": [
    "警方'不构成诈骗'的定性是否合理——79.9万转账与'真实恋爱关系'之间的张力"
  ],
  "public_evidence_refs": [
    "C015",
    "C018",
    "C020",
    "C021",
    "C025",
    "C026",
    "C027",
    "C011"
  ],
  "public_action_signals": []
}
