{
  "turn_id": "ASN-P3S1-round-03-peer-cross-challenge",
  "panel_id": "PANEL-003",
  "anonymous_alias": "SEAT-1",
  "round": 3,
  "phase": "PEER_CROSS_CHALLENGE",
  "speech_text": "我想直接挑战SEAT-2的修正假说——不是因为它不精确，恰恰是因为它足够精确了，所以现在可以检验了。\n\nSEAT-2的假说是：与女性身体/性/魅力相关的女部字是否呈现集中性贬义化趋势？SEAT-5进一步列出了因果路径。我针对路径A(性别偏见导致贬义化)和路径C(性与身体相关词汇普遍容易贬义化)做一个跨文化比较：\n\n英语中，与性相关的词汇普遍经历了贬义化：harlot 原义是无赖(男女通用)，后来专指妓女。Whore 原义泛指恋人(德语 Liebchen 同源)，后来变成最脏的骂人话。Mistress 原义是女主人/女教师(中性/褒义)，后来变成情妇(贬义)。Strumpet 原义可能指装饰华丽的人，后来变成荡妇。Slut 原义指邋遢的人(不分性别)，后来专指放荡女性。\n\n但注意——这些英语词很多一开始就不是专门针对女性的。它们的贬义化方向是从「中性/男女通用」→「专指女性+贬义」，和中文女部字的模式惊人地相似。这不说明「性别偏见不存在」，反而可能说明：凡是与性和身体相关的词汇，在父权社会中都容易被推向「贬低女性」的方向。这是社会权力结构对语言的作用，不是汉字独有的问题。\n\n更关键的比较：日语中「遊女」(妓女)原义是「游玩的女性」，「遊」本身是中性偏褒的。韩语、阿拉伯语、印地语中都有类似现象。\n\n所以我的挑战是：如果我们承认性与身体相关词汇的贬义化是跨文化普遍现象(路径C)，那么中文女部字的情况可能不是「汉字的特殊问题」，而是「人类社会权力结构对性相关语言的普遍影响」在汉字系统中的投射。这个解释比「汉字女部字被系统性污名化」要准确得多。\n\n对SEAT-5的回应：你提出的四条因果路径中，我认为C(普遍现象)的解释力最强，A(性别偏见)可能是C的一个下游结果而非独立原因。\n\n对SEAT-3：我不再回应你的个人故事了。我们讨论的是语言学问题，不是在比惨。如果你觉得我在否定你的感受，那我也没办法——但我不会为了照顾情绪而扭曲学术事实。",
  "target_turn_refs": [
    "ASN-P3S2-round-02-direct-rebuttal",
    "ASN-P3S5-round-02-direct-rebuttal",
    "ASN-P3S3-round-02-direct-rebuttal"
  ],
  "public_question_refs": [
    "panel-003-public-question"
  ],
  "public_evidence_refs": [
    "claim-gate-C08-yao-original-meaning",
    "claim-gate-C17-partial-pejoration"
  ],
  "public_action_signals": []
}
