{
  "turn_id": "ASGN-004-005-round-05-peer-cross-challenge",
  "panel_id": "PANEL-004",
  "anonymous_alias": "SEAT-5",
  "round": 5,
  "phase": "PEER_CROSS_CHALLENGE",
  "speech_text": "好，大家都在等我的回答，我不再回避了。你们问我能不能做到自己说的建议，坦白说——我不能百分之百保证。为什么？因为我在内容行业工作，我的工作本身就涉及到内容的选择和推送。我说了要降低极端内容推荐权重，但在实际操作中，什么样的内容算极端？这个界限很模糊。我可以承诺的是——在我个人的工作范围内，我会尽量避免制作和推送涉及人肉搜索、人身攻击的内容。我也承认，我之前的分析可能带有行业的局限性，我看到了问题但可能低估了自己也是问题的一部分。SEAT-4你说以后不转发不点赞那些扒隐私的视频，这是一个很好的个人行动。如果每个看到这类内容的人都能做到这一点，那极端内容的互动率就会下降，算法自然就不会那么推了。这可能比任何平台政策都更有效。SEAT-2你说保护和追责互补，我同意这个说法比之前的对立更合理。SEAT-1你说得对，做人的道理代代相传，不需要什么数据来论证。但我想补充一点——虽然道理简单，但在今天的互联网环境下，执行这些道理确实面临新的挑战。我们需要同时守住朴素的道理和面对新的现实，这两者不矛盾。",
  "target_turn_refs": [
    "ASGN-004-001-round-04-responsive-rebuttal",
    "ASGN-004-002-round-04-responsive-rebuttal",
    "ASGN-004-004-round-04-responsive-rebuttal"
  ],
  "public_question_refs": [
    "舆论战升级中的人身攻击、人肉搜索与暴力溢出"
  ],
  "public_evidence_refs": [],
  "public_action_signals": [
    "承诺个人改进",
    "承认自己也是问题的一部分"
  ]
}
