{
  "turn_id": "ASGN-003-003-round-02-direct-rebuttal",
  "panel_id": "PANEL-003",
  "anonymous_alias": "SEAT-3",
  "round": 2,
  "phase": "DIRECT_REBUTTAL",
  "speech_text": "SEAT-1质疑我说'很多菜品'是多少，是不是全部。我理解你的怀疑，毕竟你是消费者，看到的是前台。那我就说得更具体一点。\n\n我在门店工作期间，亲眼看得到后场操作的菜品类型大概有这么几类：炖菜类，很多是中央厨房炖好冷冻过来的，门店主要做加热和调味调整；蒸点类，相当一部分是预制成型送过来的，门店蒸一下就行；酱汁类的菜品，酱料基本都是中央厨房调配好密封配送的，门店撕开倒进去拌一下。这些你在明厨亮灶里能看到什么？看到师傅在'炖菜''蒸点心''拌酱汁'，但你不知道在那之前这些食材已经在冷库里躺了多久。\n\n我不是说西贝所有菜都是这样。莜面确实是在门店现做的，我也看到师傅揉面了。但问题在于，消费者没有办法区分哪些是现做、哪些是预加工的——因为门店的操作让你觉得都是现做的。\n\nSEAT-4提到零售产品的包装信息很清楚，这点我同意。但那是零售，是摆在超市货架上的产品，当然要标清楚。我们说的是门店——你去西贝门店吃饭，菜单上会写'本炖菜使用中央厨房预制半成品'吗？会标注'本酱料为工厂调配密封配送'吗？不会。这才是知情权的问题——门店端的透明度和零售端完全不是一个标准。\n\nSEAT-2说的全链条透明，SEAT-5说的锅气香精，都是行业的真实问题。我只是从员工的角度证实：消费者在门店看到的信息，确实是不完整的。",
  "target_turn_refs": [
    "ASGN-003-001-round-01-opening",
    "ASGN-003-004-round-01-opening",
    "ASGN-003-002-round-01-opening",
    "ASGN-003-005-round-01-opening"
  ],
  "public_question_refs": [
    "消费者知情权与餐饮行业透明度底线"
  ],
  "public_evidence_refs": [],
  "public_action_signals": []
}
