{
  "turn_id": "P002-SEAT-2-round-02-direct-rebuttal",
  "panel_id": "PANEL-002",
  "anonymous_alias": "SEAT-2",
  "round": 2,
  "phase": "DIRECT_REBUTTAL",
  "speech_text": "看了那个老伯说的，说老伴走了三年，一辈子温柔勤劳无私。我看的时候鼻子都酸了。我虽然不太会说这些道理，但我也觉得他说得对。人家老伴辛辛苦苦一辈子，凭什么被说成模板要打破。我身边都是我这样的姐妹，在工地、在工厂、在菜市场，哪个不是勤劳无私的好妈妈。这些付出是真的，不是什么模板。追星的妈妈说她也把孩子照顾得好，那挺好的，但别把我们的付出说成是模板就行。大家都挺不容易的，干嘛非要分个高低呢。",
  "target_turn_refs": [
    "P002-SEAT-4-round-01-opening"
  ],
  "public_question_refs": [
    "panel-002-public-question"
  ],
  "public_evidence_refs": [],
  "public_action_signals": []
}
